<?xml version="1.0" encoding="utf-8"?>
<albara xmlns:xsi="http://www.w3.org/2001/XMLSchema-instance" xsi:noNamespaceSchemaLocation="albara.xsd">  
    <codi>0001</codi>
    <data>21/05/2015</data>
    <articles>
        <article>
            <codiArticle>0001</codiArticle>
            <quantitat>7</quantitat>
            <preu>20</preu>
        </article>
        <article>
            <codiArticle>0002</codiArticle>
            <quantitat>10</quantitat>
            <preu>19</preu>
        </article>
        <article>
            <codiArticle>0004</codiArticle>
            <quantitat>2</quantitat>
            <preu>15</preu>
        </article>
        <article>
            <codiArticle>0006</codiArticle>
            <quantitat>10</quantitat>
            <preu>24</preu>
        </article>
        <article>
            <codiArticle>0008</codiArticle>
            <quantitat>5</quantitat>
            <preu>30</preu>
        </article>
        <article>
            <codiArticle>0010</codiArticle>
            <quantitat>11</quantitat>
            <preu>11</preu>
        </article>
        <article>
            <codiArticle>0012</codiArticle>
            <quantitat>13</quantitat>
            <preu>14</preu>
        </article>
        <article>
            <codiArticle>0014</codiArticle>
            <quantitat>4</quantitat>
            <preu>37</preu>
        </article>    
    </articles>
</albara>